Chapter,Text,Concepts
,"as a the input layer x is a vector of simple scalar values just as we saw in fig. 7.2. the core of the neural network is the hidden layer h formed of hidden units h;, each of which is a neural unit as described in section 7.1, taking a weighted sum of its inputs and then applying a non-linearity. in the standard architecture, each layer is fully-connected, meaning that each unit in each layer takes as input the outputs from all the units in the previous layer, and there is a link between every pair of units from two adjacent layers. thus each hidden unit sums over all the input units. recall that a cinole hidden nnit hac ac narametere a weicght vectar and ahiac wa",fully-connected
,"let’s see how this happens. like the hidden layer, the output layer has a weigt matrix (let’s call it u), but some models don’t include a bias vector b in the output",output layer
,"‘let’ s introduce some constants to represent the dimensionalities of these vectors and matrices. we’ll refer to the input layer as layer 0 of the network, and have no represent the number of inputs, so x is a vector of real numbers of dimension no, or more formally x € r"", a column vector of dimensionality [no, 1]. let’s call the hidden layer layer 1 and the output layer layer 2. the hidden layer has dimensional- ity nj, so h € r” and also b € r"" (since each hidden unit can take a different bias value). and the weight matrix w has dimensionality w € r""*""®, i.e. [ny , no]. take a moment to convince vourself that the matrix multiplication in eq. 7.8 will","7.8 will, input layer"
,"however, z can’t be the output of the classifier, since it’s a vector of real-valued 1umbers, while what we need for classification is a vector of probabilities. there is 1 convenient function for normalizing a vector of real values, by which we mean sonverting it to a vector that encodes a probability distribution (all the numbers lie xetween 0 and | and sum to 1): the softmax function that we saw on page ?? of chapter 5. more generally for any vector z of dimensionality d, the softmax is jefined ac:",normalizing
,"the need for non-linear activation functions one of the reasons we use non- linear activation functions for each layer in a neural network is that if we did not, the resulting network is exactly equivalent to a single-layer network. let’s see why this is true. imagine the first two layers of such a network of purely linear layers:",the need for non-linear activation functions
,"replacing the bias unit in describing networks, we will often use a slightly sim- plified notation that represents exactly the same function without referring to an ex- plicit bias node b. instead, we add a dummy node ao to each layer whose value will always be 1. thus layer 0, the input layer, will have a dummy node al! = 1, layer 1 will have al}! = 1, and so on. this dummy node still has an associated weight, and that weight represents the bias value b. for example instead of an equation like",replacing the bias unit
,"most neural nlp applications do something different, however. instead of us- ing hand-built human-engineered features as the input to our classifier, we draw on deep learning’s ability to learn features from the data by representing words as embeddings, like the word2vec or glove embeddings we saw in chapter 6. there are various ways to represent an input for classification. one simple baseline is to apply some sort of pooling function to the embeddings of all the words in the in- put. for example, for a text with n input words/tokens w), ..., wn», we can turn the n embeddings e(w1), ..., e(wn) (each of dimensionality d) into a single embedding also of dimensionality d by just summing the embeddings, or by taking their mean obhaos ae astes x",pooling
,"an embedding representation for our input words—is called pretraining. usin; pretrained embedding representations, whether simple static word embeddings lik« word2vec or the much more powerful contextual embeddings we’ll introduce ir chapter 11, is one of the central ideas of deep learning. (it’s also, possible, however to train the word embeddings as part of an nlp task; we’ ll talk about how to do thi: in section 7.7 in the context of the neural language modeling task.)",pretraining
,selecting the embedding vector for word vs by multiplying the embedding . e with a one-hot vector with a | in index 5.,one-hot vector
,"first, we’ll need a loss function that models the distance between the system output and the gold output, and it’s common to use the loss function used for logistic regression, the cross-entropy loss.",cross-entropy
,"the chain rule extends to more than two functions. if computing the derivative of a composite function f(x) = u(v(w(x))), the derivative of f(x) is:",chain rule
,"tuning of hyperparameters is also important. the parameters of a neural network are the weights w and biases b; those are learned by gradient descent. the hyperparameters are things that are chosen by the algorithm designer; optimal values are tuned on a devset rather than by gradient descent learning on the training set. hyperparameters include the learning rate 7, the mini-batch size, the model architecture (the number of layers, the number of hidden nodes per layer, the choice of activation functions), how to regularize, and so on. gradient descent itself also has many architectural anal ti. anal be a ae",hyperparameter
,"for some tasks, it’s ok to freeze the embedding layer e with initial word2vec val- ues. freezing means we use word2vec or some other pretraining algorithm to com- pute the initial embedding matrix e, and then hold it constant while we only modify w, u, and b, i.e., we don’t update e during language model training. however, often we'd like to learn the embeddings simultaneously with training the network. this is useful when the task the network is designed for (like sentiment classification, trans- lation, or parsing) places strong constraints on what makes a good representation fot words.",freeze
,‘various forms of regularization are used to prevent overfitting. one of the most mportant is dropout: randomly dropping some units and their connections from he network during training (hinton et al. 2012. srivastava et al. 2014). tuning,dropout
slp-7,"of the threshold into a bias, a notation we still use (widrow and hoff, 1960). the field of neural networks declined after it was shown that a single perceptron unit was unable to model functions as simple as xor (minsky and papert, 1969). while some small amount of work continued during the next two decades, a major revival for the field didn’t come until the 1980s, when practical tools for building deeper networks like error backpropagation became widespread (rumelhart et al., 1986). during the 1980s a wide variety of neural network and related architec- tures were developed, particularly for applications in psychology and cognitive sci- ence (rumelhart and mcclelland 1986b, mcclelland and elman 1986, rumelhart and mcclelland 1986a, elman 1990), for which the term connectionist or paral-",connectionist
slp-7,"se aee ae ne se ee) oe sd. nr ees: a wt in this chapter we introduce an algorithm that is admirably suited for discovering the link between features or cues and some particular outcome: logistic regression. indeed, logistic regression is one of the most important analytic tools in the social and natural sciences. in natural language processing, logistic regression is the base- line supervised machine learning algorithm for classification, and also has a very close relationship with neural networks. as we will see in chapter 7, a neural net- work can be viewed as a series of logistic regression classifiers stacked on top of each other. thus the classification and machine learning techniques introduced here will pnlav an important role throuchout the hook.",logistic regression
slp-7,"cohiponrchts of a plodadinsuc taachine icar tiie classier., = likc halve daye logistic regression is a probabilistic classifier that makes use of supervised machine learning. machine learning classifiers require a training corpus of m input/output pairs (x ‘ yl), (we’ il use superscripts in parentheses to refer to individual instances in the training set—for sentiment classification each instance might be an individual document to be classified.) a machine learning system for classification then has four comnonentc:",logistic regression
slp-7,"a generative model like naive bayes makes use of this likelihood term, which expresses how to generate the features of a document if we knew it was of class c. by contrast a discriminative model in this text categorization scenario attempts to directly compute p(c|d). perhaps it will learn to assign a high weight to document features that directly improve its ability to discriminate between possible classes, even if it couldn’t generate an example of one of the classes.",discriminative model
slp-7,"in the rest of the book we’ll represent such sums using the dot product notation from linear algebra. the dot product of two vectors a and b, written as a-b is the sum of the products of the corresponding elements of each vector. (notice that we represent vectors using the boldface notation b). thus the following is an equivalent farmationn tag fa 5 9°",dot product
slp-7,"aha ly = ux) is wie provadly wat ie gocutmeht nas ncsauve sschument, logistic regression solves this task by learning, from a training set, a vector of weights and a bias term. each weight w; is a real number, and is associated with one of the input features x;. the weight w; represents how important that input feature is to the classification decision, and can be positive (providing evidence that the in- stance being classified belongs in the positive class) or negative (providing evidence that the instance being classified belongs in the negative class). thus we might expect in a sentiment task the word awesome to have a high positive weight, and abysmal to have a very negative weight. the bias term, also called the intercept, is another real number that’s added to the weighted inputs.",intercept
slp-7,‘the sigmoid function 0(z) = y_ = takes a real value and maps it to the rang 1]. it is nearly linear around 0 but outlier values get squashed toward 0 or 1.,the sigmoid function
slp-7,"sa ee eee ee nema ey me ne re how do we make a decision about which class to apply to a test instance x? for a given x, we say yes if the probability p(y = 1|x) is more than .5, and no otherwise. we call .5 the decision boundary:",decision boundary
slp-7,designing features: features are generally designed by examining the training set with an eye to linguistic intuitions and the linguistic literature on the domain. a careful error analysis on the training set or devset of an early version of a system often provides insights into features.,designing features:
slp-7,"scaling input features: when different input features have extremely differen ranges of values, it’s common to rescale them so they have comparable ranges. we standardize input values by centering them to result in a zero mean and a standarc deviation of one (this transformation is sometimes called the z-score). that is, if uw is the mean of the values of feature x; across the m observations in the input dataset and 0; is the standard deviation of the values of features x; across the input dataset we can renlace each feature x: by a new feature x’ comnuted as follows:",standardize
slp-7,"for some tasks it is especially helpful to build complex features that are combi- nations of more primitive features. we saw such a feature for period disambiguation above, where a period on the word st. was less likely to be the end of the sentence if the previous word was capitalized. for logistic regression and naive bayes these combination features or feature interactions have to be designed by hand.","logistic regression, feature interactions"
slp-7,"in such cases we use multinomial logistic regression, also called softmax re- gression (in older nlp literature you will sometimes see the name maxent classi- fier). in multinomial logistic regression we want to label each observation with a class k from a set of k classes, under the stipulation that only one of these classes is the correct one (sometimes called hard classification; an observation can not be in multiple classes). let’s use the following representation: the output y for each input x will be a vector of length k. if class c is the correct class, we’ll set y. = 1, and set all the other elements of y to be 0, i-e., y. = 1 andy; =0 vj #c. a vector like this y, with one value=1 and the rest 0, is called a one-hot vector. the job of the classifier is produce an estimate vector §. for each class k, the value j, will be the classifier’s estimate of the probability p(y, = 1|x).","logistic regression, multinomial logistic regression"
slp-7,"the multinomial logistic classifier uses a generalization of the sigmoid, called the softmax function, to compute p(y; = 1|x). the softmax function takes a vector z= (z), 2, ..., zx]| of k arbitrary values and maps them to a probability distribution, with each value in the range (0, 1), and all the values summing to 1. like the sigmoid, it is an exponential function.",softmax
slp-7,"features in multinomial logistic regression function similarly to binary logistic re- gression, with the difference mentioned above that we’ll need separate weight vec- tors and biases for each of the k classes. recall our binary exclamation point feature",logistic regression
slp-7,"binary versus multinomial logistic regression. binary logistic regression uses a single weight vector w, and has a scalar output ¥. in multinomial logistic regression we have k separate weight vectors corresponding to the k classes, all packed into a single weight matrix w and a vector antnit 7","weight vector, output"
slp-7,"how shall we find the minimum of this (or any) loss function? gradient descent is « method that finds a minimum of a function by figuring out in which direction (in the space of the parameters @) the function’s slope is rising the most steeply, and movins in the opposite direction. the intuition is that if you are hiking in a canyon and tryins to descend most quickly down to the river at the bottom, you might look arounc yourself 360 degrees, find the direction where the ground is sloping the steepest and walk downhill in that direction.","gradient descent, gradient descent"
slp-7,"ine lf bw), or the amount to move in gradient gescent is the value of the slope alf ( x;w), y) weighted by a learning rate n. a higher (faster) learning rate means that we should move w more on each step. the change we make in our parameter is the learning rate times the gradient (or the slope, in our single-variable example):",learning rate
slp-7,"tion has just one minimum; there are no local minima to get stuck in, so gradient descent starting from any point is guaranteed to find the minimum. (by contrast, the loss for multi-layer neural networks is non-convex, and gradient descent may get stuck in local minima for neural network training and never find the global opti- mum.)",gradient
slp-7,"the learning rate 7 is a hyperparameter that must be adjusted. if it’s too high, the learner will take steps that are too large, overshooting the minimum of the loss function. if it’s too low, the learner will take steps that are too small, and take too long to get to the minimum. it is common to start with a higher learning rate and then slowly decrease it, so that it is a function of the iteration k of training; the notation mn, can be used to mean the value of the learning rate at iteration k.",hyperparameter
slp-7,"stochastic gradient descent is called stochastic because it chooses a single random example at a time, moving the weights so as to improve performance on that single example. that can result in very choppy movements, so it’s common to compute the gradient over batches of training instances rather than a single instance.",gradient descent
slp-7,"a compromise is mini-batch training: we train on a group of m examples (per- haps 512, or 1024) that is less than the whole dataset. (if m is the size of the dataset, then we are doing batch gradient descent; if m = 1, we are back to doing stochas- tic gradient descent). mini-batch training also has the advantage of computational efficiency. the mini-batches can easily be vectorized, choosing the size of the mini- batch based on the computational resources. this allows us to process all the exam- ples in one mini-batch in parallel and then accumulate the loss, something that’s not possible with individual or batch training.","batch training, mini-batch"
slp-7,"there is a problem with learning weights that make the model perfectly match the training data. if a feature is perfectly predictive of the outcome because it happens to only occur in one class, it will be assigned a very high weight. the weights for features will attempt to perfectly fit details of the training set, in fact too perfectly, modeling noisy factors that just accidentally correlate with the class. this problem is called overfitting. a good model should be able to generalize well from the training data to the unseen test set, but a model that overfits will have poor generalization. to avoid overfitting, a new regularization term r(@) is added to the objective","regularization, regularization"
slp-7,"the new regularization term r(@) is used to penalize large weights. thus a setting of the weights that matches the training data perfectly— but uses many weights with high values to do so—will be penalized more than a setting that matches the data < little less well, but does so using smaller weights. there are two common ways to compute this regularization term r(@). l2 regularization is a quadratic function of the weight values, named because it uses the (square of the) l2 norm of the weight values. the l2 norm, ||6||2, is the same as the euclidean distance of the vector 6 from the origin. if @ consists of n weights, then:",regularization
slp-7,the loss function for multinomial logistic regression generalizes the loss function for binary logistic regression from 2 to k classes. recall that that the cross-entropy loss for binary logistic regression (repeated from eq. 5.22) is:,logistic regression
slp-7,"often we want to know more than just the correct classification of an observation. we want to know why the classifier made the decision it did. that is, we want out decision to be interpretable. interpretability can be hard to define strictly, but the core idea is that as humans we should know why our algorithms reach the conclu- sions they do. because the features to logistic regression are often human-designed. one way to understand a classifier’s decision is to understand the role each feature plays in the decision. logistic regression can be combined with statistical tests (the likelihood ratio test, or the wald test); investigating whether a particular feature is significant by one of these tests, or inspecting its magnitude (how large is the weight",interpretable
slp-7,"in this section we give the derivation of the gradient of the cross-entropy loss func- tion lcg for logistic regression. let’s start with some quick calculus refreshers. first, the derivative of in(x):",logistic regression
slp-7,"finally, the chain rule of derivatives. suppose we are computing the derivative of a composite function f(x) = u(v(x)). the derivative of f(x) is the derivative of u(x) with respect to v(x) times the derivative of v(x) with respect to x",chain rule
slp-7,"speech processing, both of which had made use of regression, and both of which lent many other statistical techniques to nlp. indeed a very early use of logistic regression for document routing was one of the first nlp applications to use (lsi) embeddings as word representations (schiitze et al., 1995).",logistic regression
,"to visualize how perplexity can be computed as a function of the probabilities our lm will compute for each new word, we can use the chain rule to expand the com- putation of probability of the test set:",perplexity
,predict the next word (rather than feeding the model its best case from the previou: time step) is called teacher forcing.,teacher forcing
,"the final layer matrix v provides a way to score the likelihood of each word in the vocabulary given the evidence present in the final hidden layer of the network through the calculation of vh. this results in a dimensionality |v| x dy. that is, the rows of v provide a second set of learned word embeddings that capture relevant aspects of word meaning and function. this leads to an obvious question — is it even necessary to have both? weight tying is a method that dispenses with this redundancy and simply uses a single set of embeddings at the input and softmax layers. that is, we dispense with v and use £ in both the start and end of the computation.","weight tying, embeddings"
,"sion to depend on information from hundreds of words in the past. the transfor offers new mechanisms (self-attention and positional encodings) that help repre time and help focus on how words relate to each other over long distances. v see how to apply both models to the task of language modeling, to sequence n eling tasks like part-of-speech tagging, and to text classification tasks like sentin analysis.","words, self-attention"
,"in sequence labeling, the network’s task is to assign a label chosen from a smal fixed set of labels to each element of a sequence, like the part-of-speech tagging anc named entity recognition tasks from chapter 8. in an rnn approach to sequence labeling, inputs are word embeddings and the outputs are tag probabilities generatec by a softmax layer over the given tagset, as illustrated in fig. 9.7.",embeddings
,"ihe weights in the network are adjusted to minimize the average ch loss over the training sequence via gradient descent. fig. 9.6 illustrates this training regimen. careful readers may have noticed that the input embedding matrix e and the final layer matrix v, which feeds the output softmax, are quite similar. the columns of e represent the word embeddings for each word in the vocabulary learned during the training process with the goal that words that have similar meaning and function will have similar embeddings. and, since the length of these embeddings corresponds to the size of the hidden layer dj, the shape of the embedding matrix e is d, x |v].","words, embeddings"
,"recall that we evaluate language models by examining how well they predict unseen text. intuitively, good models are those that assign higher probabilities to unseen data (are less surprised when encountering the new words).",words
,rated = part-of-speech tagging as sequence labeling with a simple rnn. pre-traine word embeddings serve as inputs and a softmax layer provides a probability distribution ove the part-of-speech tags as output at each time step.,embeddings
,"simplified sketch of a feedforward neural language model moving through a text. at each time step ¢ the network converts n context words, each to a d-dimensional embedding, and concatenates the n embeddings together to get the nd x 1 unit input vector x for the network. the output of the network is a probability distribution over the vocabulary representing the model’s belief with respect to each word being the next possible word.","words, embeddings"
,"in this figure, the inputs at each time step are pre-trained word embeddings cor- responding to the input tokens. the rnn block is an abstraction that represents an unrolled simple recurrent network consisting of an input layer, hidden layer, and output layer at each time step, as well as the shared u, v and w weight matrices that comprise the network. the outputs of the network at each time step represent the distribution over the pos tagset generated by a softmax layer.",embeddings
,"another option, instead of using just the last token h, to represent the whole sequence, is to use some sort of pooling function of all the hidden states h; for each word i in the sequence. for example, we can create a representation that pools all the n hidden states by taking their element-wise mean:",pooling
,"stacked rnns generally outperform single-layer networks. one reason for thi success seems to be that the network induces representations at differing levels o abstraction across layers. just as the early stages of the human visual system detec edges that are then used for finding larger regions and shapes, the initial layers o stacked networks can induce representations that serve as useful abstractions fo further layers—representations that might prove difficult to induce in a single rnn the optimal number of stacked rnns is specific to each application and to eac training set. however, as the number of stacks is increased the training costs ris quickly.",stacked rnns
,"in our examples thus far, the inputs to our rnns have consisted of sequences o word or character embeddings (vectors) and the outputs have been vectors useful fo: predicting words, tags or sequence labels. however, nothing prevents us from usin; the entire sequence of outputs from one rnn as an input sequence to another one stacked rnns consist of multiple networks where the output of one layer serves a: the input to a subsequent layer, as shown in fig. 9.10.",stacked rnns
