Chapter,Text,Concepts
chapter1,"We call ourselves Homo sapiens—man the wise—because our intelligence is so important to us. For thousands of years, we have tried to understand how we think and act—that is, how our brain, a mere handful of matter, can perceive, understand, predict, and manipulate a world far larger and more complicated than itself. The field of artificial intelligence, or AI, is concerned with not just understanding but also building intelligent entities—machines that can compute how to act effectively and safely in a wide variety of novel situations.","Intelligence, Artificial Intelligence"
chapter1_1,"We have claimed that AI is interesting, but we have not said what it is. Historically, researchers have pursued several different versions of AI. Some have defined intelligence in terms of fidelity to human performance, while others prefer an abstract, formal definition of intelligence called rationality—loosely speaking, doing the “right thing.” The subject matter itself also varies: some consider intelligence to be a property of internal thought processes and reasoning, while others focus on intelligent behavior, an external characterization.1",Rationality
chapter1_1,"The Turing test, proposed by Alan Turing (1950), was designed as a thought experiment that would sidestep the philosophical vagueness of the question “Can a machine think?” A computer passes the test if a human interrogator, after posing some written questions, cannot tell whether the written responses come from a person or from a computer. Chapter 27 discusses the details of the test and whether a computer would really be intelligent if it passed. For now, we note that programming a computer to pass a rigorously applied test provides plenty to work on. The computer would need the following capabilities: natural language processing to communicate successfully in a human language; knowledge representation to store what it knows or hears; automated reasoning to answer questions and to draw new conclusions; machine learning to adapt to new circumstances and to detect and extrapolate patterns.","Turing test, Natural language processing, Knowledge representation, Automated reasoning, Machine learning, Total Turing test"
chapter1_1,"Turing viewed the physical simulation of a person as unnecessary to demonstrate intelligence. However, other researchers have proposed a total Turing test, which requires interaction with objects and people in the real world. To pass the total Turing test, a robot will need: computer vision and speech recognition to perceive the world; robotics to manipulate objects and move about.","Computer vision, Robotics"
chapter1_2,"To say that a program thinks like a human, we must know how humans think. We can learn about human thought in three ways: introspection—trying to catch our own thoughts as they go by; psychological experiments—observing a person in action; brain imaging—observing the brain in action.","Introspection, Psychological experiments, Brain imaging"
chapter1_2,"Once we have a sufficiently precise theory of the mind, it becomes possible to express the theory as a computer program. If the program’s input–output behavior matches corresponding human behavior, that is evidence that some of the program’s mechanisms could also be operating in humans. For example, Allen Newell and Herbert Simon, who developed GPS, the “General Problem Solver” (Newell and Simon 1961), were not content merely to have their program solve problems correctly. They were more concerned with comparing the sequence and timing of its reasoning steps to those of human subjects solving the same problems. The interdisciplinary field of cognitive science brings together computer models from AI and experimental techniques from psychology to construct precise and testable theories of the human mind.",Cognitive science
chapter1_3,"The Greek philosopher Aristotle was one of the first to attempt to codify “right thinking”— that is, irrefutable reasoning processes. His syllogisms provided patterns for argument structures that always yielded correct conclusions when given correct premises. The canonical example starts with Socrates is a man and all men are mortal and concludes that Socrates is mortal. (This example is probably due to Sextus Empiricus rather than Aristotle.) These laws of thought were supposed to govern the operation of the mind; their study initiated the field called logic.",Syllogisms
chapter1_3,"Logicians in the 19th century developed a precise notation for statements about objects in the world and the relations among them. (Contrast this with ordinary arithmetic notation, which provides only for statements about numbers.) By 1965, programs could, in principle, solve any solvable problem described in logical notation. The so-called logicist tradition within artificial intelligence hopes to build on such programs to create intelligent systems.",Logicist
chapter1_3,"Logic as conventionally understood requires knowledge of the world that is certain—a condition that, in reality, is seldom achieved. We simply don’t know the rules of, say, politics or warfare in the same way that we know the rules of chess or arithmetic. The theory of probability fills this gap, allowing rigorous reasoning with uncertain information. In principle, it allows the construction of a comprehensive model of rational thought, leading from raw perceptual information to an understanding of how the world works to predictions about the future. What it does not do, is generate intelligent behavior. For that, we need a theory of rational action. Rational thought, by itself, is not enough.",Probability
chapter1_4,"An agent is just something that acts (agent comes from the Latin agere, to do). Of course, all computer programs do something, but computer agents are expected to do more: operate autonomously, perceive their environment, persist over a prolonged time period, adapt to change, and create and pursue goals. A rational agent is one that acts so as to achieve the best outcome or, when there is uncertainty, the best expected outcome.","Agent, Rational agent"
chapter1_4,"In the “laws of thought” approach to AI, the emphasis was on correct inferences. Making correct inferences is sometimes part of being a rational agent, because one way to act rationally is to deduce that a given action is best and then to act on that conclusion. On the other hand, there are ways of acting rationally that cannot be said to involve inference. For example, recoiling from a hot stove is a reflex action that is usually more successful than a slower action taken after careful deliberation. All the skills needed for the Turing test also allow an agent to act rationally. Knowledge representation and reasoning enable agents to reach good decisions. We need to be able to generate comprehensible sentences in natural language to get by in a complex society. We need learning not only for erudition, but also because it improves our ability to generate effective behavior, especially in circumstances that are new. The rational-agent approach to AI has two advantages over the other approaches. First, it is more general than the “laws of thought” approach because correct inference is just one of several possible mechanisms for achieving rationality. Second, it is more amenable to scientific development. The standard of rationality is mathematically well defined and completely general. We can often work back from this specification to derive agent designs that provably achieve it—something that is largely impossible if the goal is to imitate human behavior or thought processes. For these reasons, the rational-agent approach to AI has prevailed throughout most of the field’s history. In the early decades, rational agents were built on logical foundations and formed definite plans to achieve specific goals. Later, methods based on probability theory and machine learning allowed the creation of agents that could make decisions under uncertainty to attain the best expected outcome. In a nutshell, AI has focused on the study and construction of agents that do the right thing. What counts as the right thing is defined by the objective that we provide to the agent. This general paradigm is so pervasive that we might call it the standard model. It prevails not only in AI, but also in control theory, where a controller minimizes a cost function; in operations research, where a policy maximizes a sum of rewards; in statistics, where a decision rule minimizes a loss function; and in economics, where a decision maker maximizes utility or some measure of social welfare.","Do the right thing, Standard model"
chapter1_4,"We need to make one important refinement to the standard model to account for the fact that perfect rationality—always taking the exactly optimal action—is not feasible in complex environments. The computational demands are just too high. Chapters 5 and 17 deal with the issue of limited rationality—acting appropriately when there is not enough time to do all the computations one might like. However, perfect rationality often remains a good starting point for theoretical analysis.",Limited rationality
chapter1_5,"The problem of achieving agreement between our true preferences and the objective we put into the machine is called the value alignment problem: the values or objectives put into the machine must be aligned with those of the human. If we are developing an AI system in the lab or in a simulator—as has been the case for most of the field’s history—there is an easy fix for an incorrectly specified objective: reset the system, fix the objective, and try again. As the field progresses towards increasingly capable intelligent systems that are deployed in the real world, this approach is no longer viable. A system deployed with an incorrect objective will have negative consequences. Moreover, the more intelligent the system, the more negative the consequences.",Value alignment problem
chapter1_5,"It is impossible to anticipate all the ways in which a machine pursuing a fixed objective might misbehave. There is good reason, then, to think that the standard model is inadequate. We don’t want machines that are intelligent in the sense of pursuing their objectives; we want them to pursue our objectives. If we cannot transfer those objectives perfectly to the machine, then we need a new formulation—one in which the machine is pursuing our objectives, but is necessarily uncertain as to what they are. When a machine knows that it doesn’t know the complete objective, it has an incentive to act cautiously, to ask permission, to learn more about our preferences through observation, and to defer to human control. Ultimately, we want agents that are provably beneficial to humans. We will return to this topic in Section 1.5 .",Provably beneficial
chapter2_1,"An agent is anything that can be viewed as perceiving its environment through sensors and acting upon that environment through actuators. This simple idea is illustrated in Figure 2.1 . A human agent has eyes, ears, and other organs for sensors and hands, legs, vocal tract, and so on for actuators. A robotic agent might have cameras and infrared range finders for sensors and various motors for actuators. A software agent receives file contents, network packets, and human input (keyboard/mouse/touchscreen/voice) as sensory inputs and acts on the environment by writing files, sending network packets, and displaying information or generating sounds. The environment could be everything—the entire universe! In practice it is just that part of the universe whose state we care about when designing this agent—the part that affects what the agent perceives and that is affected by the agent’s actions.","Environment, Sensor, Actuator"
chapter2_1,"We use the term percept to refer to the content an agent’s sensors are perceiving. An agent’s percept sequence is the complete history of everything the agent has ever perceived. In general, an agent’s choice of action at any given instant can depend on its built-in knowledge and on the entire percept sequence observed to date, but not on anything it hasn’t perceived. By specifying the agent’s choice of action for every possible percept sequence, we have said more or less everything there is to say about the agent. Mathematically speaking, we say that an agent’s behavior is described by the agent function that maps any given percept sequence to an action.","Percept, Percept sequence, Agent function"
chapter2_1,"We can imagine tabulating the agent function that describes any given agent; for most agents, this would be a very large table—infinite, in fact, unless we place a bound on the length of percept sequences we want to consider. Given an agent to experiment with, we can, in principle, construct this table by trying out all possible percept sequences and recording which actions the agent does in response.1 The table is, of course, an external characterization of the agent. Internally, the agent function for an artificial agent will be implemented by an agent program. It is important to keep these two ideas distinct. The agent function is an abstract mathematical description; the agent program is a concrete implementation, running within some physical system.",Agent program
chapter2_2,"A rational agent is one that does the right thing. Obviously, doing the right thing is better than doing the wrong thing, but what does it mean to do the right thing?",Rational agent
chapter2_2,"Moral philosophy has developed several different notions of the “right thing, ” but AI has generally stuck to one notion called consequentialism: we evaluate an agent’s behavior by its consequences. When an agent is plunked down in an environment, it generates a sequence of actions according to the percepts it receives. This sequence of actions causes the environment to go through a sequence of states. If the sequence is desirable, then the agent has performed well. This notion of desirability is captured by a performance measure that evaluates any given sequence of environment states.","Consequentialism, Performance measure"
chapter2_2,"What is rational at any given time depends on four things: The performance measure that defines the criterion of success. The agent’s prior knowledge of the environment. The actions that the agent can perform. The agent’s percept sequence to date. This leads to a definition of a rational agent: For each possible percept sequence, a rational agent should select an action that is expected to maximize its performance measure, given the evidence provided by the percept sequence and whatever built-in knowledge the agent has.",Definition of a rational agent
chapter2_2,"We need to be careful to distinguish between rationality and omniscience. An omniscient agent knows the actual outcome of its actions and can act accordingly; but omniscience is impossible in reality. Consider the following example: I am walking along the Champs Elysées one day and I see an old friend across the street. There is no traffic nearby and I’m not otherwise engaged, so, being rational, I start to cross the street. Meanwhile, at 33, 000 feet, a cargo door falls off a passing airliner, 3 and before I make it to the other side of the street I am flattened. Was I irrational to cross the street? It is unlikely that my obituary would read “Idiot attempts to cross street.” This example shows that rationality is not the same as perfection. Rationality maximizes expected performance, while perfection maximizes actual performance. Retreating from a requirement of perfection is not just a question of being fair to agents. The point is that if we expect an agent to do what turns out after the fact to be the best action, it will be impossible to design an agent to fulfill this specification—unless we improve the performance of crystal balls or time machines.",Omniscience
chapter2_2,"Our definition of rationality does not require omniscience, then, because the rational choice depends only on the percept sequence to date. We must also ensure that we haven’t inadvertently allowed the agent to engage in decidedly underintelligent activities. For example, if an agent does not look both ways before crossing a busy road, then its percept sequence will not tell it that there is a large truck approaching at high speed. Does our definition of rationality say that it’s now OK to cross the road? Far from it! First, it would not be rational to cross the road given this uninformative percept sequence: the risk of accident from crossing without looking is too great. Second, a rational agent should choose the “looking” action before stepping into the street, because looking helps maximize the expected performance. Doing actions in order to modify future percepts— sometimes called information gathering—is an important part of rationality and is covered in depth in Chapter 16 . A second example of information gathering is provided by the exploration that must be undertaken by a vacuum-cleaning agent in an initially unknown environment. Our definition requires a rational agent not only to gather information but also to learn as much as possible from what it perceives. The agent’s initial configuration could reflect some prior knowledge of the environment, but as the agent gains experience this may be modified and augmented. There are extreme cases in which the environment is completely known a priori and completely predictable. In such cases, the agent need not perceive or learn; it simply acts correctly.","Information gathering, Learning"
chapter2_2,"Slightly more intelligent is the sphex wasp. The female sphex will dig a burrow, go out and sting a caterpillar and drag it to the burrow, enter the burrow again to check all is well, drag the caterpillar inside, and lay its eggs. The caterpillar serves as a food source when the eggs hatch. So far so good, but if an entomologist moves the caterpillar a few inches away while the sphex is doing the check, it will revert to the “drag the caterpillar” step of its plan and will continue the plan without modification, re-checking the burrow, even after dozens of caterpillar-moving interventions. The sphex is unable to learn that its innate plan is failing, and thus will not change it. To the extent that an agent relies on the prior knowledge of its designer rather than on its own percepts and learning processes, we say that the agent lacks autonomy. A rational agent should be autonomous—it should learn what it can to compensate for partial or incorrect prior knowledge. For example, a vacuum-cleaning agent that learns to predict where and when additional dirt will appear will do better than one that does not.",Autonomy
chapter2_3,"Now that we have a definition of rationality, we are almost ready to think about building rational agents. First, however, we must think about task environments, which are essentially the “problems” to which rational agents are the “solutions.” We begin by showing how to specify a task environment, illustrating the process with a number of examples. We then show that task environments come in a variety of flavors. The nature of the task environment directly affects the appropriate design for the agent program. In our discussion of the rationality of the simple vacuum-cleaner agent, we had to specify the performance measure, the environment, and the agent’s actuators and sensors. We group all these under the heading of the task environment. For the acronymically minded, we call this the PEAS (Performance, Environment, Actuators, Sensors) description. In designing an agent, the first step must always be to specify the task environment as fully as possible.","Task environment, PEAS"
chapter2_3,"FULLY OBSERVABLE VS. PARTIALLY OBSERVABLE: If an agent’s sensors give it access to the complete state of the environment at each point in time, then we say that the task environment is fully observable. A task environment is effectively fully observable if the sensors detect all aspects that are relevant to the choice of action; relevance, in turn, depends on the performance measure. Fully observable environments are convenient because the agent need not maintain any internal state to keep track of the world. An environment might be partially observable because of noisy and inaccurate sensors or because parts of the state are simply missing from the sensor data—for example, a vacuum agent with only a local dirt sensor cannot tell whether there is dirt in other squares, and an automated taxi cannot see what other drivers are thinking. If the agent has no sensors at all then the environment is unobservable. One might think that in such cases the agent’s plight is hopeless, but, as we discuss in Chapter 4 , the agent’s goals may still be achievable, sometimes with certainty.","Fully observable, Partially observable, Unobservable"
chapter2_3,"SINGLE-AGENT VS. MULTIAGENT: The distinction between single-agent and multiagent environments may seem simple enough. For example, an agent solving a crossword puzzle by itself is clearly in a single-agent environment, whereas an agent playing chess is in a two- agent environment. However, there are some subtle issues. First, we have described how an entity may be viewed as an agent, but we have not explained which entities must be viewed as agents. Does an agent (the taxi driver for example) have to treat an object (another vehicle) as an agent, or can it be treated merely as an object behaving according to the laws of physics, analogous to waves at the beach or leaves blowing in the wind? The key distinction is whether ’s behavior is best described as maximizing a performance measure whose value depends on agent ’s behavior.","Single-agent, Multiagent"
chapter2_3,"For example, in chess, the opponent entity is trying to maximize its performance measure, which, by the rules of chess, minimizes agent ’s performance measure. Thus, chess is a competitive multiagent environment. On the other hand, in the taxi-driving environment, avoiding collisions maximizes the performance measure of all agents, so it is a partially cooperative multiagent environment. It is also partially competitive because, for example, only one car can occupy a parking space.","Competitive, Cooperative"
chapter2_3,"The agent-design problems in multiagent environments are often quite different from those in single-agent environments; for example, communication often emerges as a rational behavior in multiagent environments; in some competitive environments, randomized behavior is rational because it avoids the pitfalls of predictability. Deterministic vs. nondeterministic. If the next state of the environment is completely determined by the current state and the action executed by the agent(s), then we say the environment is deterministic; otherwise, it is nondeterministic. In principle, an agent need not worry about uncertainty in a fully observable, deterministic environment. If the environment is partially observable, however, then it could appear to be nondeterministic.","Deterministic, Nondeterministic"
chapter2_3,"One final note: the word stochastic is used by some as a synonym for “nondeterministic, ” but we make a distinction between the two terms; we say that a model of the environment is stochastic if it explicitly deals with probabilities (e.g., “there’s a 25% chance of rain tomorrow”) and “nondeterministic” if the possibilities are listed without being quantified (e.g., “there’s a chance of rain tomorrow”).",Stochastic
chapter2_3,"EPISODIC VS. SEQUENTIAL: In an episodic task environment, the agent’s experience is divided into atomic episodes. In each episode the agent receives a percept and then performs a single action. Crucially, the next episode does not depend on the actions taken in previous episodes. Many classification tasks are episodic. For example, an agent that has to spot defective parts on an assembly line bases each decision on the current part, regardless of previous decisions; moreover, the current decision doesn’t affect whether the next part is defective. In sequential environments, on the other hand, the current decision could affect all future decisions.4 Chess and taxi driving are sequential: in both cases, short-term actions can have long-term consequences. Episodic environments are much simpler than sequential environments because the agent does not need to think ahead.","Episodic, Sequential, Static, Dynamic"
chapter2_3,"STATIC VS. DYNAMIC: If the environment can change while an agent is deliberating, then we say the environment is dynamic for that agent; otherwise, it is static. Static environments are easy to deal with because the agent need not keep looking at the world while it is deciding on an action, nor need it worry about the passage of time. Dynamic environments, on the other hand, are continuously asking the agent what it wants to do; if it hasn’t decided yet, that counts as deciding to do nothing. If the environment itself does not change with the passage of time but the agent’s performance score does, then we say the environment is semidynamic. Taxi driving is clearly dynamic: the other cars and the taxi itself keep moving while the driving algorithm dithers about what to do next. Chess, when played with a clock, is semidynamic. Crossword puzzles are static.",Semidynamic
