Chapter,Text,Concepts
chapter5_3,"To make use of our limited computation time, we can cut off the search early and apply a heuristic evaluation function to states, effectively treating nonterminal nodes as if they were terminal. In other words, we replace the UTILITY function with EVAL, which estimates a state’s utility. We also replace the terminal test by a cutoff test, which must return true for terminal states, but is otherwise free to decide when to cut off the search, based on the search depth and any property of the state that it chooses to consider.",cutoff test
,"Let us make this idea more concrete. Most evaluation functions work by calculating various features of the state—for example, in chess, we would have features for the number of white pawns, black pawns, white queens, black queens, and so on. The features, taken together, define various categories or equivalence classes of states: the states in each category have the same values for all the features. For example, one category might contain all two-pawn versus one-pawn endgames. Any given category will contain some states that lead (with perfect play) to wins, some that lead to draws, and some that lead to losses.",Features
chapter5_3,"The evaluation function should be applied only to positions that are quiescent—that is, positions in which there is no pending move (such as a capturing the queen) that would wildly swing the evaluation. For nonquiescent positions the IS-CUTOFF returns false, and the search continues until quiescent positions are reached. This extra quiescence search is sometimes restricted to consider only certain types of moves, such as capture moves, that will quickly resolve the uncertainties in the position.","Quiescence, Quiescence search"
chapter5_3,"One strategy to mitigate the horizon effect is to allow singular extensions, moves that are “clearly better” than all other moves in a given position, even when the search would normally be cut off at that point.",Singular extension
chapter5_3,"Alpha–beta pruning prunes branches of the tree that can have no effect on the final evaluation, but forward pruning prunes moves that appear to be poor moves, but might possibly be good ones. Thus, the strategy saves computation time at the risk of making an error.",Forward pruning
chapter5_3,"Another technique, late move reduction, works under the assumption that move ordering has been done well, and therefore moves that appear later in the list of possible moves are less likely to be good moves. But rather than pruning them away completely, we just reduce the depth to which we search these moves, thereby saving time. If the reduced search comes back with a value above the current α value, we can re-run the search with the full depth.",Late move reduction
chapter16_1,"Decision theory, in its simplest form, deals with choosing among actions based on the desirability of their immediate outcomes; that is, the environment is assumed to be episodic in the sense defined on page 45. (This assumption is relaxed in Chapter 17.) The agent’s preferences are captured by a utility function, U(s), which assigns a single number to express the desirability of a state. The expected utility of an action given the evidence, EU(a) , is just the average utility value of the outcomes, weighted by the probability that the outcome occurs","Utility function, Expected utility"
chapter16_2,"ORDERABILITY: Given any two lotteries, a rational agent must either prefer one or else rate them as equally preferable. That is, the agent cannot avoid deciding. As noted on page 394, refusing to bet is like refusing to allow time to pass. TRANSITIVITY: Given any three lotteries, if an agent prefers A to B and prefers B to C, then the agent must prefer A to C. CONTINUITY: If some lottery is between and in preference, then there is some probability for which the rational agent will be indifferent between getting for sure and the lottery that yields with probability and with probability 1-p. SUBSTITUTABILITY: If an agent is indifferent between two lotteries A and B, then the agent is indifferent between two more complex lotteries that are the same except that B is substituted for A in one of them. This holds regardless of the probabilities and the other outcome(s) in the lotteries. MONOTONICITY: Suppose two lotteries have the same two possible outcomes, A and B. If an agent prefers A to B, then the agent must prefer the lottery that has a higher probability for A(and vice versa). DECOMPOSABILITY: Compound lotteries can be reduced to simpler ones using thelaws of probability. This has been called the “no fun in gambling” rule: as Figure16.1(b) shows, it compresses two consecutive lotteries into a single equivalentlottery.","Orderability, Transitivity, Continuity, Substitutability, Monotonicity, Decomposability"
chapter16_2,"As in game-playing, in a deterministic environment an agent needs only a preference ranking on states—the numbers don’t matter. This is called a value function or ordinal utility function.","Value function, Ordinal utility function"
chapter16_3,"If we want to build a decision-theoretic system that helps a human make decisions or acts on his or her behalf, we must first work out what the human’s utility function is. This process, often called preference elicitation, involves presenting choices to the human and using the observed preferences to pin down the underlying utility function.",Preference elicitation
chapter16_3,"Currently several agencies of the U.S. government, including the Environmental Protection Agency, the Food and Drug Administration, and the Department of Transportation, use the value of a statistical life to determine the costs and benefits of regulations and interventions. Typical values in 2019 are roughly $10 million. Some attempts have been made to find out the value that people place on their own lives. One common “currency” used in medical and safety analysis is the micromort, a one in a million chance of death. If you ask people how much they would pay to avoid a risk—for example, to avoid playing Russian roulette with a million-barreled revolver—they will respond with very large numbers, perhaps tens of thousands of dollars, but their actual behavior reflects a much lower monetary value for a micromort.","Value of a statistical life, Micromort"
chapter16_3,"It will usually be the case that an agent prefers more money to less, all other things being equal. We say that the agent exhibits a monotonic preference for more money. This does not mean that money behaves as a utility function, because it says nothing about preferences between lotteries involving money.",Monotonic preference
chapter16_3,"That is, agents with curves of this shape are risk-averse: they prefer a sure thing with a payoff that is less than the expected monetary value of a gamble. On the other hand, in the “desperate” region at large negative wealth in Figure 16.2(b), the behavior is risk-seeking. The value an agent will accept in lieu of a lottery is called the certainty equivalent of the lottery. Studies have shown that most people will accept about $400 in lieu of a gamble that gives $1000 half the time and $0 the other half—that is, the certainty equivalent of the lottery is $400, while the EMV is $500. The difference between the EMV of a lottery and its certainty equivalent is called the insurance premium. Risk aversion is the basis for the insurance industry, because it means that insurance premiums are positive. People would rather pay a small insurance premium than gamble the price of their house against the chance of a fire. From the insurance company’s point of view, the price of the house is very small compared with the firm’s total reserves. This means that the insurer’s utility curve is approximately linear over such a small region, and the gamble costs the company almost nothing.","Risk-averse, Risk-seeking, Certainty equivalent, Insurance premium"
chapter16_3,"Notice that for small changes in wealth relative to the current wealth, almost any curve will be approximately linear. An agent that has a linear curve is said to be risk-neutral. For gambles with small sums, therefore, we expect risk neutrality. In a sense, this justifies the simplified procedure that proposed small gambles to assess probabilities and to justify the axioms of probability in Section 12.2.3.",Risk-neutral
chapter16_3,"It is a straightforward matter to calculate the distribution of the maximum of the k estimates and hence quantify the extent of our disappointment. (This calculation is a special case of computing an order statistic, the distribution of any particular ranked element of a sample.) Suppose that each estimate Xi has a probability density function f(x) and cumulative distribution F(x).",order statistic
chapter16_3,"Decision theory is a normative theory: it describes how a rational agent should act. A descriptive theory, on the other hand, describes how actual agents—for example, humans— really do act. The application of economic theory would be greatly enhanced if the two coincided, but there appears to be some experimental evidence to the contrary. The evidence suggests that humans are “predictably irrational”","Normative theory, Descriptive theory"
chapter6_1,"A domain, Di, consists of a set of allowable values, {v1, …, vk}, for variable Xi. For example, a Boolean variable would have the domain {true, false}. Different variables can have different domains of different sizes. Each constraint Cj consists of a pair ⟨scope, rel⟩, where scope is a tuple of variables that participate in the constraint and rel is a relation that defines the values that those variables can take on. A relation can be represented as an explicit set of all tuples of values that satisfy the constraint, or as a function that can compute whether a tuple is a member of the relation.",Relation
chapter6_1,"CSPs deal with assignments of values to variables, {Xi = vi, Xj = vj, …}. An assignment that does not violate any constraints is called a consistent or legal assignment. A complete assignment is one in which every variable is assigned a value, and a solution to a CSP is a consistent, complete assignment. A partial assignment is one that leaves some variables unassigned, and a partial solution is a partial assignment that is consistent. Solving a CSP is an NP-complete problem in general, although there are important subclasses of CSPs that can be solved very efficiently.","Assignments, Consistent, Complete assignment, Solution, Partial assignment, Partial solution"
chapter6_1,"It can be helpful to visualize a CSP as a constraint graph. The nodes of the graph correspond to variables of the problem, and an edge connects any two variables that participate in a constraint.",Constraint graph
chapter6_1,"The simplest kind of CSP involves variables that have discrete, finite domains. Map-coloring problems and scheduling with time limits are both of this kind. The 8-queens problem can also be viewed as a finite-domain CSP, where the variables Q1, …, Q8 correspond to the queens in columns 1 to 8, and the domain of each variable specifies the possible row numbers for the queen in that column, Di = {1, 2, 3, 4, 5, 6, 7, 8}. The constraints say that no two queens can be in the same row or diagonal.","Discrete domain, Finite domain"
chapter6_1,"A discrete domain can be infinite, such as the set of integers or strings. (If we didn’t put a deadline on the job-scheduling problem, there would be an infinite number of start times for each variable.) With infinite domains, we must use implicit constraints like T1 + d1 ≤ T2 rather than explicit tuples of values. Special solution algorithms (which we do not discuss here) exist for linear constraints on integer variables—that is, constraints, such as the one just given, in which each variable appears only in linear form. It can be shown that no algorithm exists for solving general nonlinear constraints on integer variables—the problem is undecidable.","Infinite, Linear constraints, Nonlinear constraints"
chapter6_1,"In addition to examining the types of variables that can appear in CSPs, it is useful to look at the types of constraints. The simplest type is the unary constraint, which restricts the value of a single variable. For example, in the map-coloring problem it could be the case that South Australians won’t tolerate the color green; we can express that with the unary constraint ⟨(SA), SA ≠ green⟩. (The initial specification of the domain of a variable can also be seen as a unary constraint.) A binary constraint relates two variables. For example, SA ≠ NSW is a binary constraint. A binary CSP is one with only unary and binary constraints. A constraint involving an arbitrary number of variables is called a global constraint. (The name is traditional but confusing because a global constraint need not involve all the variables in a problem). One of the most common global constraints is Alldiff, which says that all of the variables involved in the constraint must have different values. In Sudoku problems (see Section 6.2.6), all variables in a row, column, or 3 × 3 box must satisfy an Alldiff constraint.",Unary constraint
chapter6_1,"The constraints we have described so far have all been absolute constraints, violation of which rules out a potential solution. Many real-world CSPs include preference constraints indicating which solutions are preferred. For example, in a university class-scheduling problem there are absolute constraints that no professor can teach two classes at the same time. But we also may allow preference constraints: Prof. R might prefer teaching in the morning, whereas Prof. N prefers teaching in the afternoon. A schedule that has Prof. R teaching at 2 p.m. would still be an allowable solution (unless Prof. R happens to be the department chair) but would not be an optimal one.",Preference constraints
chapter6_1,"Preference constraints can often be encoded as costs on individual variable assignments—for example, assigning an afternoon slot for Prof. R costs 2 points against the overall objective function, whereas a morning slot costs 1. With this formulation, CSPs with preferences can be solved with optimization search methods, either path-based or local. We call such a problem a constrained optimization problem, or COP. Linear programs are one class of COPs.",Constrained optimization problem
chapter6_2,"An atomic state-space search algorithm makes progress in only one way: by expanding a node to visit the successors. A CSP algorithm has choices. It can generate successors by choosing a new variable assignment, or it can do a specific type of inference called constraint propagation: using the constraints to reduce the number of legal values for a variable, which in turn can reduce the legal values for another variable, and so on. The idea is that this will leave fewer choices to consider when we make the next choice of a variable assignment. Constraint propagation may be intertwined with search, or it may be done as a preprocessing step, before search starts. Sometimes this preprocessing can solve the whole problem, so no search is required at all.",Constraint propagation
chapter6_2,"The key idea is local consistency. If we treat each variable as a node in a graph and each binary constraint as an edge, then the process of enforcing local consistency in each part of the graph causes inconsistent values to be eliminated throughout the graph. There are different types of local consistency, which we now cover in turn.",Local consistency
chapter6_2,"A single variable (corresponding to a node in the CSP graph) is node-consistent if all the values in the variable’s domain satisfy the variable’s unary constraints. For example, in the variant of the Australia map-coloring problem where South Australians dislike green, the variable SA starts with domain {red, green, blue}, and we can make it node consistent by eliminating green, leaving SA with the reduced domain {red, blue}. We say that a graph is node-consistent if every variable in the graph is node-consistent.",Node consistency
chapter6_2,"A variable in a CSP is arc-consistent1 if every value in its domain satisfies the variable’s binary constraints. More formally, Xi is arc-consistent with respect to another variable Xj if for every value in the current domain Di there is some value in the domain Dj that satisfies the binary constraint on the arc (Xi, Xj). A graph is arc-consistent if every variable is arc-consistent with every other variable. For example, consider the constraint Y = X2 where the domain of both X and Y is the set of decimal digits.",Arc consistency
chapter6_2,"Arc consistency tightens down the domains (unary constraints) using the arcs (binary constraints). To make progress on problems like map coloring, we need a stronger notion of consistency. Path consistency tightens the binary constraints by using implicit constraints that are inferred by looking at triples of variables.",Path consistency
chapter6_2,"Stronger forms of propagation can be defined with the notion of k-consistency. A CSP is k-consistent if, for any set of k − 1 variables and for any consistent assignment to those variables, a consistent value can always be assigned to any kth variable. 1-consistency says that, given the empty set, we can make any set of one variable consistent: this is what we called node consistency. 2-consistency is the same as arc consistency. For binary constraint graphs, 3-consistency is the same as path consistency.",k-consistency
chapter6_2,"Another important higher-order constraint is the resource constraint, sometimes called the Atmost constraint. For example, in a scheduling problem, let P1, …, P4 denote the numbers of personnel assigned to each of four tasks. The constraint that no more than 10 personnel are assigned in total is written as Atmost(10, P1, P2, P3, P4). We can detect an inconsistency simply by checking the sum of the minimum values of the current domains; for example, if each variable has the domain {3, 4, 5, 6}, the Atmost constraint cannot be satisfied. We can also enforce consistency by deleting the maximum value of any domain if it is not consistent with the minimum values of the other domains. Thus, if each variable in our example has the domain {2, 3, 4, 5, 6}, the values 5 and 6 can be deleted from each domain.",Resource constraint
chapter6_2,"For large resource-limited problems with integer values—such as logistical problems involving moving thousands of people in hundreds of vehicles—it is usually not possible to represent the domain of each variable as a large set of integers and gradually reduce that set by consistency-checking methods. Instead, domains are represented by upper and lower bounds and are managed by bounds propagation.",bounds propagation
chapter6_2,"We say that a CSP is bounds-consistent if for every variable X, and for both the lower--ound and upper-bound values of X, there exists some value of Y that satisfies the constraint between X and Y for every variable Y . This kind of bounds propagation is widely used in practical constraint problems.",Bounds-consistent
chapter6_3,"This intuitive idea—choosing the variable with the fewest “legal” values—is called the minimum-remaining-values (MRV) heuristic. It also has been called the “most constrained variable” or “fail-first” heuristic, the latter because it picks a variable that is most likely to cause a failure soon, thereby pruning the search tree. If some variable X has no legal values left, the MRV heuristic will select X and failure will be detected immediately—avoiding pointless searches through other variables. The MRV heuristic usually performs better than a random or static ordering, sometimes by orders of magnitude, although the results vary depending on the problem.",minimum-remaining-values
chapter6_3,"The MRV heuristic doesn’t help at all in choosing the first region to color in Australia, because initially every region has three legal colors. In this case, the degree heuristic comes in handy. It attempts to reduce the branching factor on future choices by selecting the variable that is involved in the largest number of constraints on other unassigned variables.The minimum- remaining-values heuristic is usually a more powerful guide, but the degree heuristic can be useful as a tie-breaker. Once a variable has been selected, the algorithm must decide on the order in which to examine its values. The least-constraining-value heuristic is effective for this. It prefers the value that rules out the fewest choices for the neighboring variables in the constraint graph.","Degree heuristic, Least-constraining-value"
chapter6_3,"One of the simplest forms of inference is called forward checking. Whenever a variable X is assigned, the forward-checking process establishes arc consistency for it: for each unassigned variable Y that is connected to X by a constraint, delete from Y ’s domain any value that is inconsistent with the value chosen for X.",forward-checking
chapter6_3,"The algorithm called MAC (for Maintaining Arc Consistency) detects inconsistencies like this. After a variable Xi is assigned a value, the INFERENCE procedure calls AC-3, but instead of a queue of all arcs in the CSP, we start with only the arcs (Xj, Xi) for all Xj that are unassigned variables that are neighbors of Xi. From there, AC-3 does constraint propagation in the usual way, and if any variable has its domain reduced to the empty set, the call to AC-3 fails and we know to backtrack immediately. We can see that MAC is strictly more powerful than forward checking because forward checking does the same thing as MAC on the initial arcs in MAC’s queue; but unlike MAC, forward checking does not recursively propagate constraints when changes are made to the domains of variables.",Maintaining Arc Consistency
chapter6_3,"The BACKTRACKING-SEARCH algorithm in Figure 6.5 has a very simple policy for what to do when a branch of the search fails: back up to the preceding variable and try a different value for it. This is called chronological backtracking because the most recent decision point is revisited. In this subsection, we consider better possibilities.",Chronological backtracking
chapter6_3,"A more intelligent approach is to backtrack to a variable that might fix the problem—a variable that was responsible for making one of the possible values of SA impossible. To do this, we will keep track of a set of assignments that are in conflict with some value for SA. The set (in this case {Q = red, NSW = green, V = blue}), is called the conflict set for SA. The backjumping method backtracks to the most recent assignment in the conflict set; in this case, backjumping would jump over Tasmania and try a new value for V . This method is easily implemented by a modification to BACKTRACK such that it accumulates the conflict set while checking for a legal value to assign. If no legal value is found, the algorithm should return the most recent element of the conflict set along with the failure indicator.","Conflict set, Backjumping"
chapter6_3,"This leads to a different–and deeper–notion of the conflict set for a variable such as NT: it is that set of preceding variables that caused NT, together with any subsequent variables, to have no consistent solution. In this case, the set is WA and NSW, so the algorithm should backtrack to NSW and skip over Tasmania. A backjumping algorithm that uses conflict sets defined in this way is called conflict-directed backjumping.",Conflict-directed backjumping
chapter6_3,"When we reach a contradiction, backjumping can tell us how far to back up, so we don’t waste time changing variables that won’t fix the problem. But we would also like to avoid running into the same problem again. When the search arrives at a contradiction, we know that some subset of the conflict set is responsible for the problem. Constraint learning is the idea of finding a minimum set of variables from the conflict set that causes the problem. This set of variables, along with their corresponding values, is called a no-good. We then record the no-good, either by adding a new constraint to the CSP to forbid this combination of assignments or by keeping a separate cache of no-goods.","Constraint learning, No-good"
chapter6_4,"Local search algorithms (see Section 4.1) turn out to be very effective in solving many CSPs. They use a complete-state formulation (as introduced in Section 4.1.1) where each state assigns a value to every variable, and the search changes the value of one variable at a time. As an example, we’ll use the 8-queens problem, as defined as a CSP on page 183. In Figure 6.8 we start on the left with a complete assignment to the 8 variables; typically this will violate several constraints. We then randomly choose a conflicted variable, which turns out to be Q8, the rightmost column. We’d like to change the value to something that brings us closer to a solution; the most obvious approach is to select the value that results in the minimum number of conflicts with other variables—the min-conflicts heuristic.",Min-conflicts
